<?xml version="1.0" encoding="UTF-8"?>
<xs:schema xmlns:xs="http://www.w3.org/2001/XMLSchema">

  <xs:element name="Customer">
    <xs:complexType>
      <xs:sequence>
        <xs:element name="CustomerID" type="xs:string"/>
        <xs:element name="Name" type="xs:string"/>
        <xs:element name="Email" type="xs:string"/>
        <xs:element name="Account">
          <xs:complexType>
            <xs:sequence>
              <xs:element name="AccountNumber" type="xs:string"/>
              <xs:element name="AccountType" type="xs:string"/>
              <xs:element name="Balance" type="xs:decimal"/>
            </xs:sequence>
          </xs:complexType>
        </xs:element>
      </xs:sequence>
    </xs:complexType>
  </xs:element>

</xs:schema>
